{
  "id": "badge-level-09-week-35",
  "title": "Week 35 Graph Cartographer",
  "description": "Awarded for completing the Week 35 Gradle and build-engineering checkpoint.",
  "categoryId": "level-09-gradle-build-cicd",
  "icon": "build-week-35",
  "criteria": {
    "type": "complete_checkpoint",
    "targetId": "quiz-level-09-week-35-checkpoint",
    "minimumScore": 0.8
  },
  "xp": 450,
  "rarity": "rare",
  "version": "0.12.0"
}
