{
  "id": "badge-level-11-week-45",
  "title": "Week 45 Launch Tracer",
  "description": "Awarded for completing the Week 45 Android internals checkpoint with version-matched causal evidence.",
  "categoryId": "level-11-android-internals-aosp",
  "icon": "internals-week-45",
  "criteria": {
    "type": "complete_checkpoint",
    "targetId": "quiz-level-11-week-45-checkpoint",
    "minimumScore": 0.8
  },
  "xp": 475,
  "rarity": "rare",
  "version": "0.14.0"
}
