{
  "id": "badge-level-05-week-22",
  "title": "Week 22 Banking Architect",
  "description": "Awarded for completing the Week 22 production architecture checkpoint.",
  "categoryId": "level-05-production-architecture",
  "icon": "architecture-week-22",
  "criteria": {
    "type": "complete_checkpoint",
    "targetId": "quiz-level-05-week-22-checkpoint",
    "minimumScore": 0.8
  },
  "xp": 350,
  "rarity": "rare",
  "version": "0.8.0"
}
