{
  "id": "badge-level-10-week-40",
  "title": "Week 40 Performance Investigator",
  "description": "Awarded for completing the Week 40 profiling and runtime performance checkpoint with representative evidence.",
  "categoryId": "level-10-performance-reliability-observability",
  "icon": "performance-week-40",
  "criteria": {
    "type": "complete_checkpoint",
    "targetId": "quiz-level-10-week-40-checkpoint",
    "minimumScore": 0.8
  },
  "xp": 450,
  "rarity": "rare",
  "version": "0.13.0"
}
