{
  "id": "badge-level-12-week-48",
  "title": "Week 48 SDK Publisher",
  "description": "Awarded for completing the Week 48 specialization checkpoint with reproducible expert evidence.",
  "categoryId": "level-12-advanced-specialisations",
  "icon": "specialisation-week-48",
  "criteria": {
    "type": "complete_checkpoint",
    "targetId": "quiz-level-12-week-48-checkpoint",
    "minimumScore": 0.8
  },
  "xp": 500,
  "rarity": "rare",
  "version": "1.0.0"
}
