{
  "id": "badge-level-07-week-30",
  "title": "Week 30 Release Guardian",
  "description": "Awarded for completing the Week 30 testing and quality checkpoint.",
  "categoryId": "level-07-testing-quality-engineering",
  "icon": "testing-week-30",
  "criteria": {
    "type": "complete_checkpoint",
    "targetId": "quiz-level-07-week-30-checkpoint",
    "minimumScore": 0.8
  },
  "xp": 400,
  "rarity": "rare",
  "version": "0.10.0"
}
